no,page,jap,eng,small,vmn,chn
5,ooame,指定緊急避難場所,emergency evacuation site,きけんなとき、いのちをまもるためにじぶんたちでいそいでひなんするためのばしょ,Nơi trú ẩn khẩn cấp được chỉ định,指定紧急避难场所
6,ooame,移動手段・移動時間,transportation、time,うごくためのほうほう・うごくためにかかるじかん,Phương tiện di chuyển・Thời gian di chuyển,移动方式・移动时间
0,ooame1,問１　自宅に災害リスクがありますか？,Q1 Does your house have disaster risk?,もんだい1　じぶんのいえにさいがいのかのうせいがありますか？,Câu hỏi 1: Nhà của bạn có nguy cơ thiên tai không?,问题1：您的住所是否存在灾害风险？
1,ooame1,水害のリスク,flood risk,こうずいのせいでおこるさいがいのかのうせい,Nguy cơ lũ lụt,水灾风险
2,ooame1,浸水の深さを入力してください,enter the depth of inundation,みずがはいってきたときのみずのふかさをにゅうりょくしてください,Hãy nhập độ sâu ngập nước.,请输入可能的淹水深度
3,ooame1,土砂災害のリスク,Landslide risk,やまやがけがくずれたり、つちやすながかわにながれたりするかのうせい,Nguy cơ lở đất,山体滑坡风险
0,ooame2,問２　自宅を離れた避難（立退き避難）が必要ですか？,Do you need an evacuation away from home?,もんだい2　じぶんのいえからはなれたひなんがひつようですか？,Câu hỏi 2: Có cần phải di tản rời khỏi nhà (di tản cưỡng chế) không?,问题2：是否需要撤离避难？
1,ooame2, 条件が一つでも当てはまれば、立退き避難が必要です。,If even one of the conditions is met、 it is necessary to evacuate.,ひとつでもあてはまるものがあったら、いそいでそのばをはなれてひなんそろことがだいじです。,Nếu một trong các điều kiện này được áp dụng、 thì việc di tản cưỡng chế là cần thiết.,如果符合以下任一条件、就需要撤离避难。
2,ooame2,水害のリスク,flood risk,こうずいのせいでおこるさいがいのかのうせい,Nguy cơ lũ lụt,水灾风险
3,ooame2,家屋倒壊等氾濫想定区域である,It is an area where flooding that collapses houses is expected.,いえがこわれるかのうせいがあるばしょである,Là khu vực dự kiến bị ngập lụt hoặc sập nhà.,住所位于洪水泛滥预想区域
4,ooame2,居室は、浸水の深さより低い,The living room is lower than the depth of inundation,へや・しんしつ・だいどころはみずがはいってきたときのたかさよりひくい,Phòng ở thấp hơn độ sâu ngập nước,居住房间低于预想淹水深度
5,ooame2,水・食料奈等の備えが十分でない,Insufficient stock of water、 food、 etc.,みず・たべものなどのじゅんびができていない,Không có đủ nước、 thực phẩm、 hoặc đồ dự trữ cần thiết,水和食物等储备不足
6,ooame2,土砂災害のリスク,Landslide risk,やまやがけがくずれたり、つちやすながかわにながれたりするかのうせい,Nguy cơ lở đất,山体滑坡风险
7,ooame2,十分堅牢なマンションの上階等ではない,Not on the upper floors of a sufficiently robust apartment,かたくてじょうぶなマンジョンのうえのほうではない,Không phải là tầng trên của tòa nhà chung cư đủ kiên cố,住所并非坚固的高层建筑
0,ooame3,問３　立退き避難の避難先はどこですか？ ,Q3 Where is the evacuation site?,もんだい3　ひなんさきはどこですか？,Câu hỏi 3: Nơi di tản khi sơ tán cưỡng chế của bạn ở đâu?,问题3：撤离避难的目的地是哪里？
1,ooame3,問２で災害リスクがない場合も危険を感じた場合の立退き避難先を考えてください。,Even if there is no disaster risk in Q2、 think about where to evacuate if you feel danger.,もんだい2でさいがいのかのうせいないときもあぶないとかんじたときのみをまもるためのひなんさきをかんがえてください。,Ngay cả khi không có nguy cơ thiên tai trong Câu hỏi 2、 hãy suy nghĩ về nơi di tản cưỡng chế nếu bạn cảm thấy nguy hiểm.,即使在问题2中没有灾害风险、也请考虑在感到危险时的撤离避难地点。
2,ooame3,A 安全な場所に住んでいて身を寄せられる親戚や知人はいますか？　いたら記入してください。,A Do you have relatives or acquaintances who live in a safe place and can go to?  Please fill in if applicable.,A　あんぜんなばしょにすんでいてしんらいできるしんせきやともだちはいますか？,A. Có người thân hoặc bạn bè nào sống ở nơi an toàn mà bạn có thể nương nhờ không? Nếu có、 hãy ghi rõ.,A 您是否有住在安全地区并可依靠的亲戚或朋友？如有、请填写。
3,ooame3,B 指定緊急避難場所はどこですか？,B Where is the assigned　emergency evacuation site?,B　きめてあるひなんばしょはどこですか？,B. Nơi trú ẩn khẩn cấp được chỉ định của bạn ở đâu?,B 指定的紧急避难场所在哪里？
0,ooame4,問４　自分または一緒に避難する方は避難に時間がかかりますか？,Q4 Does it take any time for you or the person evacuating with you to evacuate?,もんだい4　じぶん、またはいっしょにひなんするひとはひなんにじかんがかかりますか？,Câu hỏi 4: Bạn hoặc những người sơ tán cùng bạn có mất nhiều thời gian để sơ tán không?,问题4：您或同行避难者是否需要较长的避难时间？
1,ooame4,※本アプリは移動時間の合計が30分を目安に判定を行います。,This application judges the total move time based on 30 minutes as a guide.,※このアプリはいどうじかんのごうけいが３０分をきじゅんにじかんをはかっています。,※ Ứng dụng này sẽ đánh giá dựa trên tổng thời gian di chuyển khoảng 30 phút.,※本应用将避难所需的总时间以30分钟为基准进行判断。
2,ooame4,誰と,with who,だれと,Đi cùng ai,与谁同行
3,ooame4,移動手段,transportation,いどうのほうほう,Phương tiện di chuyển,移动方式
4,ooame4,準備にかかる時間,time to prepare,いどうにかかるじかん,Thời gian chuẩn bị,准备所需时间
5,ooame4,移動にかかる時間,time to move,いどうにかかるじかん,Thời gian di chuyển,移动所需时间
6,ooame4,移動時間の合計,total move time,いどうじかんのごうけい,Tổng thời gian di chuyển,总移动时间
0,ooame5,問５　自宅に、予測が困難な災害リスクがありますか？,Q5 Does your home have disaster risks that are difficult to predict?,もんだい5　じぶんのいえに、そうぞうができないようなさいがいのかのうせいがありますか？,Câu hỏi 5: Nhà của bạn có nguy cơ thiên tai khó dự đoán không?,问题5：您的住所是否存在难以预测的灾害风险？
1,ooame5,自宅に、以下の条件が当てはまりますか?１つでも当てはまれば、予測困難な災害リスク「あり」です。,Do any of the following apply to your home? If even one is true、 there is a disaster risk that is difficult to predict.,じぶんのいえに、このしたのじょうけんがあてはまりますか？ひとつでもあてはまったら、そうぞうができないようなさいがいのかのうせい「あり」です。,Nhà của bạn có thuộc các điều kiện sau đây không? Nếu có một điều kiện áp dụng、 sẽ được coi là có nguy cơ thiên tai khó dự đoán.,您的住所是否符合以下条件？如果符合任意一项、则存在难以预测的灾害风险。
2,ooame5,(１)急激な水位上昇のおそれがある河川が近くにある。,(1)There is a nearby river that is at risk of a sudden rise in water level.,(1)　きゅうにみずがふえるかのうせいがあるかわがちかくにある。,(1) Có con sông gần đó có khả năng mực nước tăng đột ngột.,1.住所附近有可能发生急剧水位上升的河流。
3,ooame5,(２)土砂災害のリスクがある。,(2)There is a risk of landslide disaster.,(2)　やまやがけがくずれたり、つちやすながかわにながれたりするかのうせいがある。,(2) Có nguy cơ lở đất.,2.存在山体滑坡的风险。
0,ooame_lv1,安全な場所にいる人まで避難する必要はありません,People in safe places do not need to evacuate.,あんぜんなばしょにいるひとまでひなんするひつようはないです,Những người ở nơi an toàn không cần phải sơ tán.,处于安全地区的人无需避难。
1,ooame_llv1,ハザードマップで表現されていない災害リスクを見逃さないよう、事前にしっかり確認しましょう,Be sure to check in advance so that you do not miss any disaster risks that are not displayed on the hazard map.,ハザードマップにかかれていないさいがいのかのうせいをみおとさないように、しっかりとかくにんしましょう。,Hãy kiểm tra kỹ trước để không bỏ sót các rủi ro thiên tai không được thể hiện trên bản đồ nguy cơ.,请提前仔细确认、避免忽略灾害地图上未标示的灾害风险。
0,ooame_llv2,自宅に留まり安全確保することも可能です,You can stay home and stay safe,じぶんのいえにいてあんぜんをたもつこともできます,Bạn cũng có thể ở lại nhà để đảm bảo an toàn.,也可以选择留在家中确保安全。
1,ooame_llv2,少しでも上へ移動　山や崖等から離れた部屋へ移動　危険を感じたら立退き避難,Move up even a little. Move to a room away from mountains、 cliffs、 etc. Evacuate if you feel danger.,すこしでもうえにいどう　やまやがけなどからはなれたへやにいどう　きけんだなとおもったらすぐにひなん,Hãy di chuyển lên nơi cao hơn、 đến phòng cách xa núi hoặc vách đá、 và sơ tán nếu cảm thấy nguy hiểm.,尽量向高处移动、远离山体或悬崖的房间、如感到危险应立即撤离避难。
0,ooame_llv3,警戒レベル３で確実に避難,Surely evacuate at alert level 3,けいかいレベル3でぜったいにひなん,Sơ tán chắc chắn ở mức cảnh báo cấp 3.,预警等级3：高龄者等应立即避难
1,ooame_llv3,高齢者等避難,Evacuation order for the elderly,としをとったおじいちゃんおばあちゃんたちはひなん,Sơ tán người cao tuổi và các đối tượng cần hỗ trợ.,高龄者等避难
0,ooame_llv4,警戒レベル４で確実に避難,Surely evacuate at alert level 4,けいかいレベル4でぜったいにひなん,Sơ tán chắc chắn ở mức cảnh báo cấp 4.,预警等级4：所有人必须立即避难
1,ooame_llv4,避難指示,evacuation order,ひなんのめいれい,Chỉ thị sơ tán.,避难指示
0,ooame6,大雨時の行動整理,Arrange actions during heavy rain,おおあめのときのじぶんのこうどうの,Sắp xếp hành động khi có mưa lớn.,整理暴雨时的行动计划
1,ooame6,ハザードマップを表示,display hazard map,ハザードマップをひょうじする,Hiển thị bản đồ nguy cơ.,显示灾害地图
2,ooame6,避難所を表示,display evacuation center,ひなんするところをひょうじする,Hiển thị nơi trú ẩn.,显示避难所
3,ooame6,判定,judge,はんていする,Phán định,评估
4,ooame6,次へ,next,つぎへ,Tiếp theo,下一步
0,hinan,ピンを選んで長押しすると、”ルート”を表示します,Select a pin and press and hold to display the route .,ピンを長おすると、”ルート”が表示されます,"Chọn ghim và nhấn giữ để hiển thị ""lộ trình"".",长按选择的标记可显示“路线”。
1,hinan,洪水,flood,こうずい,Lũ lụt,洪水
2,hinan,地震,earthquake,じしん,Động đất,地震
3,hinan,津波,tsunami,つなみ,Sóng thần,海啸
4,hinan,避難所,Shelter,ひなんするばしょ,Nơi trú ẩn,避难所
5,hinan,もどる,Back,もどる,Quay lại,返回
6,hinan,現在地,You are here,いまいるばしょ,Vị trí hiện tại,当前位置
7,hinan,検索,search,けんさく,Tìm kiếm,搜索
8,hinan,ルート,root,ルート,Lộ trình,路线
9,hinan,撮る,screenshot,スクリーンショット,Chụp ảnh,拍摄
11,hinan,住所から検索,Search by address,住所からさがす,Tìm kiếm từ địa chỉ,通过地址搜索
12,hinan,データベース登録件数,Number of database registrations,データベース登録件数,Số lượng mục đã đăng ký trong cơ sở dữ liệu,数据库登记件数
13,hinan,しばらくお待ちください..,Please wait..,ちょっと待ってね,Vui lòng chờ trong giây lát...,请稍候…
14,hinan,読込み件数が100％でない時は、すべてのデータを削除して、再度読込み処理を実行してください。,If the number of items read is not 100%、please delete all data and perform the reading process again.,読込み件数が100％でない時は、すべてのデータを削除して、再度読込み処理を実行してください。,Nếu số lượng dữ liệu đọc vào chưa đạt 100%、 hãy xóa tất cả dữ liệu và thực hiện lại quá trình tải dữ liệu.,如果数据读取未达到100%、请删除所有数据后重新读取。
15,hinan,データ読込み,Data loading,データ読込み,Tải dữ liệu,读取数据
16,hinan,削除,Delete,消します,Xóa,删除
0,hinanSave,インターネットに接続できない状態に備えて、避難所・避難場所や避難所までにルート等を保存するページです。最大４画面保存できます。,This page saves evacuation sites、 evacuation sites、 routes to evacuation sites、 etc. in case you cannot connect to the Internet. Up to 4 screens can be saved.,インターネットにつなぐことができないときのために、ひなんするばしょやひなんするばしょにいくためのいきかたをのこしておくためのページです。いちばんおおくて4つぶんのこしておくことができます。,Trang lưu thông tin về nơi trú ẩn、 địa điểm sơ tán và lộ trình đến nơi trú ẩn để sử dụng trong trường hợp không có kết nối Internet. Có thể lưu tối đa 4 màn hình.,本页面可用于在无法连接互联网的情况下、保存避难所、避难地点及前往避难所的路线。最多可保存4个画面。
1,hinanSave,_画像をタップすると拡大できます。画像を長押しすると削除できます。,Tap the image to enlarge. Press and hold the image to delete it.,がめんをたっぷするとおおきくひょうじできます。がぞうをながおしするとそのがぞうをすてることができます。,Nhấn vào hình ảnh để phóng to. Nhấn giữ hình ảnh để xóa.,点击图片可放大、长按图片可删除。
2,hinanSave,撮る,screenshot,スクリーンショット,Chụp ảnh,拍摄
3,hinanSave,削除確認,Delete confirmation,すてたかどうかかくにんする,Xác nhận xóa,删除确认
4,hinanSave,このデータを削除していいですか？,Are you sure you want to delete this data?,このデータをすててもいいですか？,Bạn có chắc chắn muốn xóa dữ liệu này không?,确定要删除此数据吗？
5,hinanSave,データがいっぱいです。,Data is full.,データがたくさんになりました。,Dữ liệu đã đầy.,数据已满。
6,hinanSave,新しい写真を保存するには、既存の写真を削除してください。,Please delete the existing photo to save the new photo.,あたらしいしゃしんをのこしておくためには、もともとのこしてあったしゃしんをすててください。,Để lưu ảnh mới、 hãy xóa ảnh hiện có.,要保存新照片、请先删除现有照片。
7,hinanSave,削除するには、対象の写真を長押ししてください。,Long press on the desired photo to delete it.,しゃしんをすてるためには、すてたいとおもうしゃしんをながおししてください。,Để xóa、 hãy nhấn giữ ảnh cần xóa.,长按目标照片即可删除。
1,lv1,心構えを高める！, Increase preparedness !,こころのじゅんびをちゃんとする！,Nâng cao ý thức phòng bị!,提高防灾意识！
2,lv1,災害への心構えを高める必要があることを示す警戒レベル１です。,this is level 1 which indicates that you have necessary to increase preparedness.,さいがいへのこころのじゅんびをちゃんとするひつようがあることをあらわしているけいかいレベル1です。,Đây là mức cảnh báo cấp độ 1、 cho thấy cần nâng cao ý thức phòng bị trước thiên tai.,这是表示需要提高防灾意识的预警等级1。
3,lv1,最新の防災気象情報等に留意するなど、災害への心構えを高めてください。,please increase your preparedness for disaster to pay attension to the newest disaster privention informasion and so on,あたらしいさいがいのよほうやじょうほうなどにきをつけて、さいがいへのこころのじゅんびをしっかりとしましょう。,Hãy chú ý đến thông tin khí tượng phòng chống thiên tai mới nhất để nâng cao ý thức phòng bị trước thiên tai.,请关注最新的防灾气象信息等、提高防灾意识。
4,lv2,避難行動の確認！,confirm the action for refuge,ひなんするためのこうどうのみなおし！,Xác nhận hành động sơ tán!,确认避难行动！
5,lv2,避難行動の確認が必要とされる警戒レベル２です。,this is level 2 which indicates that requires to confirm the action for refuge,ひなんするためのこうどうのみなおしがひつようとしているけいかいレベル2です。,Đây là mức cảnh báo cấp độ 2、 yêu cầu xác nhận hành động sơ tán.,这是需要确认避难行动的预警等级2。
6,lv2,ハザードマップ等により、災害が想定されている区域や避難先、避難経路を確認してください。,please confirm the action for refuge and check evacuation sites and areas where disasters are estimated ,ハザードマップなどによって、さいがいのかのうせいがあるかもしれないばしょやひなんするばしょ、ひなんするときのいきかたをみなおしてください。,Hãy kiểm tra bản đồ nguy hiểm (hazard map)、 khu vực dự kiến bị thiên tai、 nơi sơ tán và lộ trình sơ tán.,请使用灾害地图等确认可能发生灾害的区域、避难地点及避难路线。
7,lv3,高齢者は危険な場所から避難！,seniors please refuge from dangerous place,おじいちゃんおばあちゃんはあぶないばしょからにげよう！,Người cao tuổi cần sơ tán khỏi nơi nguy hiểm!,老年人应立即从危险区域避难！
8,lv3,地元の自治体が警戒レベル３高齢者等避難を発令する目安となる情報です。高齢者等は危険な場所からの避難が必要とされる警戒レベル３に相当します。,this is level 3 which indicates that seniors need to refuge from dangerous place. And this is a standard information that municipalities issue evacuation order for elderly、etc.,じぶんのすんでいるちくのじちたいがけいかいレベル3おじいちゃんおばあちゃんたちのひなんをするめやすとなるじょうほうです。おじいちゃんおばあちゃんはきけんなばしょからにげるひつようがあるけいかいレベル3になります。,Đây là thông tin làm cơ sở để chính quyền địa phương ban hành mức cảnh báo cấp độ 3 về sơ tán người cao tuổi.Cấp độ cảnh báo 3 yêu cầu người cao tuổi cần phải sơ tán khỏi nơi nguy hiểm.,这是当地政府发布预警等级3（老年人等避难）的参考信息。
9,lv3,災害が想定されている区域等では、自治体からの高齢者等避難の発令に留意するとともに、高齢者等以外の方もキキクル（危険度分布）や河川の水位情報等を用いて避難の準備をしたり自ら避難の判断をしたりしてください。,please pay attension to anouncement evacuation order for elderly、etc. others get ready to refuge and figure to refuge by yourselves by considering Kikikuru or River water level infomation. ,さいがいがおこるかもしれないばしょは、じぶんのすんでいるちくのじちたいからのおじいちゃんおばあちゃんたちのひなんのめいれいにきをつけておいて、おじいちゃんおばあちゃんたちいがいのひとたちもキキクル（きけんレベルひょう）やかわのみずのりょうにじょうほうなどをつかってひなんするためのじゅんびをしたり、じぶんでひなんをするかどうかをきめてください。,Ở các khu vực có nguy cơ thiên tai、 hãy chú ý thông tin sơ tán dành cho người cao tuổi từ chính quyền địa phương. Những người khác ngoài người cao tuổi cũng nên sử dụng thông tin Kikikuru (phân bố mức độ nguy hiểm) và mực nước sông để chuẩn bị hoặc tự đưa ra quyết định sơ tán.,在预计会发生灾害的区域、请注意政府发布的老年人等避难通知。同时、非老年人群体也应利用**キキクル（危险度分布）**或河流水位信息做好避难准备、并自主判断是否需要避难。
10,lv4,危険な場所から避難！,please refuge from dangerous place,きけんなばしょからすぐににげよう！,Sơ tán khỏi nơi nguy hiểm!,立即从危险区域避难！
11,lv4,地元の自治体が警戒レベル４避難指示を発令する目安となる情報です。危険な場所からの避難が必要とされる警戒レベル４に相当します。,this is level 4 which indicates that needs to refuge from dangerous place. And this is a piece of standard information that municipalities issue evacuation order.,じぶんのすんでいるちくのじちたいがけいかいレベル4ひなんめいれいをだすめやすとなるじょうほうです。きけんなばしょからひなんしてにげることがひつようになるけいかいレベル4にあたります。,Đây là thông tin làm cơ sở để chính quyền địa phương ban hành mức cảnh báo cấp độ 4 về chỉ thị sơ tán.Cấp độ cảnh báo 4 yêu cầu sơ tán khỏi nơi nguy hiểm.,这是当地政府发布预警等级4（避难指示）的参考信息。
12,lv4,災害が想定されている区域等では、自治体からの避難指示の発令に留意するとともに、避難指示が発令されていなくてもキキクル（危険度分布）や河川の水位情報等を用いて自ら避難の判断をしてください。,please pay attension to anouncement evacuation order、 get ready to refuge and figure to refuge by yourselves by considering Kikikuru or River water level infomation. ,さいがいがおこるかもしれないばしょは、じぶんのすんでいるちくのじちたいからのおじいちゃんおばあちゃんたちのひなんのめいれいにきをつけておいて、おじいちゃんおばあちゃんたちいがいのひとたちもキキクル（きけんレベルひょう）やかわのみずのりょうにじょうほうなどをつかってひなんするためのじゅんびをしたり、じぶんでひなんをするかどうかをきめてください。,Ở các khu vực dự kiến xảy ra thiên tai、 hãy chú ý đến chỉ thị sơ tán từ chính quyền địa phương. Ngay cả khi chưa có chỉ thị sơ tán、 hãy sử dụng thông tin Kikikuru (phân bố mức độ nguy hiểm) hoặc mực nước sông để tự đưa ra quyết định sơ tán.,在预计会发生灾害的区域、请注意政府发布的避难指示。此外、即使尚未发布避难指示、也应利用**キキクル（危险度分布）**或河流水位信息来自行判断是否需要避难。
13,lv5,高い所へ避難！！川から離れる！,refuge to higher ground ! leave river !,たかいばしょへにげる！かわからはなれて！,Sơ tán lên nơi cao!! Tránh xa dòng sông!,立即前往高处避难！远离河流！
